{
  "schemaVersion": "1.1",
  "runId": "10000000-0000-4000-8000-000000000001",
  "tenantId": "10000000-0000-4000-8000-000000000002",
  "userId": "10000000-0000-4000-8000-000000000003",
  "threadId": "run:10000000-0000-4000-8000-000000000001",
  "status": "queued",
  "originalQuestion": "How should export controls affect semiconductor investment strategy?",
  "normalizedQuestion": "How should export controls affect semiconductor investment strategy?",
  "reportRequirements": [],
  "activePlanId": null,
  "planVersion": 0,
  "subQuestionIds": [],
  "sourceIds": [],
  "evidenceClaimIds": [],
  "gapIds": [],
  "reflectionRound": 0,
  "concurrencyLimit": 3,
  "reflectionDecision": null,
  "budget": {
    "maxWallClockMs": 120000,
    "maxSearchCalls": 12,
    "maxBrowserSessions": 0,
    "maxReflectionRounds": 1,
    "maxInputTokens": 100000,
    "maxOutputTokens": 20000,
    "maxEstimatedCostUsd": 5
  },
  "usage": {
    "searchCalls": 0,
    "browserSessions": 0,
    "inputTokens": 0,
    "outputTokens": 0,
    "estimatedCostUsd": 0,
    "reservedSearchCalls": 0,
    "reservedEstimatedCostUsd": 0
  },
  "reportId": null,
  "cancellationRequestedAt": null,
  "cancelledAt": null,
  "errorCode": null,
  "createdAt": "2026-09-28T12:00:00Z",
  "updatedAt": "2026-09-28T12:00:00Z"
}
